num,keyword,name,famous_for,link,rating_in_site,website,address,review,business_id,review_count,rating,open_hour,comment
9,Patty Melt at Cassell's Hamburgers,Cassell's Hamburgers,Patty Melt ,https://www.timeout.com/los-angeles/restaurants/cassells-hamburgers,3,http://www.cassellshamburgers.com,'3600 W 6th St Los Angeles 90020',"
Cassell’s Hamburgers is part of The Normandie Hotel’s multi-million dollar makeover, one that includes the adjacent Le Comptoir and The Normandie Club. Yet Cassell’s itself isn’t new, per se. The original diner, founded by Al Cassell in 1948 and located just a couple blocks away, was an institution, known for its burgers, patty melts and slices of pie; a Korean family bought it in 2006, running the restaurant until it closed again in 2012 (quit playing with our hearts!). Now reimagined by chef Christian Page, the relocated Cassell’s pays tribute with ‘50s memorabilia hanging on the walls and the use of the diner’s original Hobart meat grinder and patty press. A lot has changed, though, and not necessarily for the better.
The menu is basic, with variations on burgers and sandwiches that evoke lunch box staples. A lackluster tuna melt elicited indifferent shrugs around our table, which was discouraging for a $14 sandwich.  I know, I know: the tuna is wild-caught albacore soaked in pickle juice; the mayo is homemade. Still—it could use a jolt of flavor, or at least something to warrant its plumped-up price tag. Other hot, melted options are better: a patty melt uses house ground beef with a slice of cheese (your choice of cheddar or Swiss) on toasted rye, while the burger is Cassell's all-around winner. Page uses natural, hormone-free Colorado Angus, which he grinds twice a day. It shows—the beef is rich and tender without being greasy, and the Parker House bun does its job soaking up the burger's contents without falling apart. Is it one of the best burgers I’ve had in LA? Nah, but it’s a good one.
A banchan-like collection of sides came with our order, including three salads: potato salad, coleslaw, and a macaroni salad that reminded me of family picnics, in the very best way. It makes up for the fact that Cassell’s doesn’t offer French fries at the moment, a stance taken by Al Cassell, who favored chips instead. But the public wants what it wants, and our server informed us that a plan to put fries on the menu was in the works. She also offered us a second helping of our sides, which never came, so I don’t really know what to believe. I can believe in the pie here, though. The filling options change daily and involve a flaky crust, a side scoop of ice cream, and a sense of simplicity that, I think, would have pleased Cassell himself.
Vitals
What to Eat: The burger ($10.99 for 1/3 lb., $15.99 for 2/3 lb.). The patty melt ($11.99). The macaroni salad ($2.50). The mixed berry pie ($5).
What to Drink: There’s a reason diners aren’t known for their booze. Cassell’s has a hefty cocktail menu (each drink is $10), with a separate list for brunch drinks, like the Brass Monkey, a mix of Colt 45 malt liquor and OJ. We tried a couple—the Sidearm, made with Bulleit Rye and Fernet; the Root Cause, made with bourbon—but each drink was loaded with small chips of ice that quickly melted, leaving our drinks watery and weak. It’s better to go for the shakes, malts and house sodas. Sweet and bitter, sarsparilla ($3.50) is poured into a huge glass, certainly enough to last you through your meal and providing the necessary dose of nostalgia that cocktails just don’t do for a diner.
Where to Sit: Cassell’s is great for people-watching: tables are pushed up against windows that look out onto Normandie and 6th Street. There’s a counter, too, which might provide a more authentic feel—even if sipping on a watery cocktail at the counter doesn’t.
",Q3pwRtT8v8oTCKFEYJgCbg,1581,4.0,"['On Monday open : 1100 close 2100 open overnight : False', 'On Tuesday open : 1100 close 2100 open overnight : False', 'On Wednesday open : 1100 close 2100 open overnight : False', 'On Thursday open : 1100 close 2100 open overnight : False', 'On Friday open : 1100 close 2100 open overnight : False', 'On Saturday open : 1100 close 2100 open overnight : False', 'On Sunday open : 1100 close 2100 open overnight : False']","['Diner food made right! Served with a side of pie :) \n\nLet me start off by saying that at the restaurant, the staff was super friendly and attentive, and the...', 'They\'re doing takeout & delivery through their website and app during the ""safer-at-home"" order.  Support them and get a great (and extremely filling) meal...', 'A group of 3 of us came here as a back-up after another burger joint we wanted to try ended up being closed.  We were mostly happy with the food, and though...']"
10,The Smash Burger at Electric Owl,Electric Owl,The Smash Burger ,https://www.timeout.com/los-angeles/restaurants/electric-owl,no rating,http://www.electricowl.la,'1451 N Gardner St West Hollywood 90046',"
Los Angeles is home to a lot of gastropubs, but a gastropub that nails a perfect burger? Now that's a rarity. But in West Hollywood's Electric Owl, you'll find fantastic burgers smothered in house-made cheese, in addition to the selection of California-produce–inspired salads, pizzas, pastas and cocktails.
",ly7L13OVHcSOm1JSuFwKwg,383,4.0,"['On Monday open : 1130 close 1500 open overnight : False', 'On Monday open : 1615 close 2300 open overnight : False', 'On Tuesday open : 1130 close 1500 open overnight : False', 'On Tuesday open : 1615 close 2300 open overnight : False', 'On Wednesday open : 1130 close 1500 open overnight : False', 'On Wednesday open : 1615 close 2300 open overnight : False', 'On Thursday open : 1130 close 1500 open overnight : False', 'On Thursday open : 1615 close 2300 open overnight : False', 'On Friday open : 1000 close 1500 open overnight : False', 'On Friday open : 1615 close 0000 open overnight : False', 'On Saturday open : 1000 close 0000 open overnight : False', 'On Sunday open : 1000 close 2300 open overnight : False']","['This is a new find for me, had some work in West Hollywood and needed a place to eat. We happened upon the Electric Owl! Very comfortable setting, friendly...', 'Why the hell am I sitting inside, when I asked four times to sit outside? I waited 45 minutes to sit inside after requesting the patio. The pro of this...', 'I was here a few weeks ago to meet a friend for brunch. I started my review and moved on.\n\nThen, Yelp reminded me that I had an outstanding review and I...']"
11,Bacon Cheeseburger at Bill's Hamburgers,Bill's Hamburgers,Bacon Cheeseburger ,https://www.timeout.com/los-angeles/restaurants/bills-hamburgers,5,no_website,'14742 Oxnard St Los Angeles 91411',"
This weekday-only, retro burger counter has been serving the Valley since 1965. Husband and wife team Bill and Hiroko grill every burger (on a well-seasoned flattop) to order and their bacon cheeseburger ($5.30) could easily be the pin-up as the ultimate classic burger: A nicely seared patty, mayo, tomato, lettuce, crisp bacon strips and American cheese is sandwiched between griddled buns, served with ridged potato chips on the side. Regulars drop in for lunch at the counter or back patio, and veterans know to add grilled onions to their orders.
",0upo44caHvgYeA34PSNFRQ,703,4.5,"['On Tuesday open : 0830 close 1600 open overnight : False', 'On Wednesday open : 0830 close 1600 open overnight : False', 'On Thursday open : 0830 close 1600 open overnight : False', 'On Friday open : 0900 close 1600 open overnight : False']","[""My husband finally got to try Bill's burgers today since he's working from home due to the current happenings with CV...and today is     Tuesday...takeout..."", 'I am sorry, Bill. Your business model doesnt work in 21st century\nRight after I came the manager informed that I have to wait for about 30 (!) minutes to...', ""The prime definition of a hole in the wall. Surrounded by industrial looking buildings/businesses up the wazoo, Bill's Hamburgers dishes out simple, but...""]"
12,Office Burger at Father's Office,Father's Office,Office Burger ,https://www.timeout.com/los-angeles/restaurants/fathers-office-1,no rating,http://www.fathersoffice.com,'1018 Montana Ave Los Angeles 90403',"
This neighborhood staple (a touch smaller location than its Culver City locale) from renowned chef Sang Yoon is always loud and jam-packed. Expect to stand around with a beer in hand while mingling with friends—tables are first-come, first-served. The upscale bar food includes the messy, delicious cult-favorite Office burger with Applewood bacon, gruyere and maytag blue cheese. The beer menu is almost triple the length of the eats menu.
",wBeNozAR6wlJLTEwdWdPQg,6023,3.5,"['On Monday open : 1700 close 0000 open overnight : False', 'On Tuesday open : 1700 close 0000 open overnight : False', 'On Wednesday open : 1700 close 0000 open overnight : False', 'On Thursday open : 1700 close 0000 open overnight : False', 'On Friday open : 1200 close 0100 open overnight : True', 'On Saturday open : 1200 close 0100 open overnight : True', 'On Sunday open : 1200 close 2300 open overnight : False']","['We have been ordering from FO almost weekly since everything has gone into COVID lock down. Helms bakery has been making special treats daily, and we have...', 'Mouthwatering is an understatement when it comes to The Office Burger, from entry to exit brace yourself for a hamburger experience worthy of...', ""Fathers Office is legendary and it's silly how they only 3.5 stars. There are definitely too many overly emotional 1 and 2 star reviews on here.\n\nMy...""]"
13,Double HiHo at HiHo Cheeseburger,HiHo Cheeseburger,Double HiHo ,https://www.timeout.com/los-angeles/restaurants/hiho-cheeseburger,no rating,https://www.hiho.la,'1320 2nd St Santa Monica 90401',"
The burgers at HiHo aren't groundbreaking in flavor, but they're practically groundbreaking when it comes to sourcing: The meat is entirely wagyu, grass-fed, non-GMO and non-antibiotic, and the beef comes from cows raised by the certified-humane collective First Light Farm. The result? Tender, perfectly seared beef that almost melts on the tongue, and is easy on the conscience, too. You can go either double or triple (sorry, no singles here, unless you're opting for the house-made vegan patty), and go best with a side of those hand-cut, twice-fried fries.
",Z31Vy7P8B5y7gIw0fYeUGg,116,4.0,"['On Monday open : 1130 close 2200 open overnight : False', 'On Tuesday open : 1130 close 2200 open overnight : False', 'On Wednesday open : 1130 close 2200 open overnight : False', 'On Thursday open : 1130 close 2200 open overnight : False', 'On Friday open : 1130 close 2200 open overnight : False', 'On Saturday open : 1130 close 2200 open overnight : False', 'On Sunday open : 1130 close 2200 open overnight : False']","['I wanted HiHo because a buddy of mine has been talking them up for months.  My wife ordered postmates in store pick up for the family. I get there and they...', ""I've been looking to try HiHo Cheeseburgers for a while now, but had to wait until my recent trip to the US to have one.  Well, wouldn't you know it, but it..."", ""This burger is one of the best I've had in a looooonggg time. Ordered takeout due to COVID and food was ready when they said it would be. Not too expensive...""]"
14,The Royale at Oinkster,Oinkster,The Royale ,https://www.timeout.com/los-angeles/restaurants/oinkster,4,http://www.theoinkster.com,'2005 Colorado Blvd Los Angeles 90041',"
Journey over to the Oinkster for some extra-decadent takes on American classics by well-known chef Andre Guerrero. Order a slow-roasted pulled BBQ pork sandwich and crispy Belgian-style fries at this ""slow fast food"" joint. The garlic aioli and chipotle ketchup, made in-house for dipping fries in, truly elevate the standard side. Guy Fieri himself is a fan of the house-cured pastrami and slow-smoked pork, but we're also champions for The Oinkster's burgers, like The Royale (an Angus patty with bacon, chili and pastrami). Wash your food down with one of their draft beers—they have local, California craft brews to expand your culinary palette.
",df6TLmeTiLyzrKnAPKnn2w,3608,4.0,"['On Monday open : 1100 close 2200 open overnight : False', 'On Tuesday open : 1100 close 2200 open overnight : False', 'On Wednesday open : 1100 close 2200 open overnight : False', 'On Thursday open : 1100 close 2200 open overnight : False', 'On Friday open : 1100 close 2200 open overnight : False', 'On Saturday open : 1100 close 2200 open overnight : False', 'On Sunday open : 1100 close 2200 open overnight : False']","[""Super mega excellent tasty sandos here. Sometimes you want to say all this stuff but really here you don't have to. The covid 19 take out all dialed in and..."", 'My family enjoys this place, having been here twice before and enjoyed the burgers, pastrami, and shakes. I was set to order a whole meal here today and...', 'Quality, taste, price - best burgers in LA. \n\nI used to eat chili cheese everything from The Hat and swore it off all things chilli cheese for a good couple...']"
15,The Mister O's Burger at Mister O's,Mister O's,The Mister O's Burger ,https://www.timeout.com/los-angeles/restaurants/mister-os,no rating,https://misterosla.com,'11838 Ventura Blvd Studio City 91604',"
Mid-Century Modern decor meets Modern American cuisine in one of Studio City's best neighborhood restaurants. Mr. O's is the kind of place where you can curl up by the fire pit with a few hearty handmade pastas in the evening, or take bites of plum jam with whipped cheese on focaccia in the sunny dining room at brunch. If you're dining with a crew, you're in luck: Now you can order a little bit of everything, and if you're there on a Sunday night, there are family-style meals available.
",ma3MRxILFJZW9Ffr3CkAcQ,228,4.0,"['On Tuesday open : 1200 close 1900 open overnight : False', 'On Wednesday open : 1200 close 1900 open overnight : False', 'On Thursday open : 1200 close 1900 open overnight : False', 'On Friday open : 1200 close 1900 open overnight : False', 'On Saturday open : 1200 close 1900 open overnight : False']","[""I drove all the way to Studio City after work from\nDTLA to meet a friend for dinner at Mister O's. Trust me, it was worthwhile to deal with the bad..."", 'Cool atmosphere little slow for a Saturday night!  \n\nOrdered the burger it was pretty good event tho they forgot the aoli sauce and I asked for no salt on...', ""Came here on a Saturday night (10ish) and to my surprise there weren't too many people at the bar or dining. I say to my surprise because it is such a cute...""]"
16,Whipper Burger at Hawkins House of Burgers,Hawkins House of Burgers,Whipper Burger ,https://www.timeout.com/los-angeles/restaurants/hawkins-house-of-burgers,no rating,http://www.hawkinsburgers.com,'11603 S Slater St Los Angeles 90059',"
When chowing down at Watt’s prized Hawkins House of Burgers, you’ll need to harness that ‘go big or go home’ mentality. Scores of hungry Angelenos line up at this stand turned casual restaurant for American classics at a bargain price. Burgers packed with high quality Angus beef, fresh ingredients and tons of flavor can be smelled down the block. Sure, this no-frills burger joint is vastly informal, but that just spotlights the Fat Chili Cheese Burger, Double Bacon Egg Cheese Burger, and other tasty fares that much more. If you want to give a whack at the Triple burger (that’s three fully stacked burgers piled into one tower for $8.99), go for it—but you’ll need an impressive pack of napkins (and maybe some forks) at the ready.
",BA7TnabiZhm4S5Jv7jbkxA,1421,4.5,"['On Monday open : 0800 close 2200 open overnight : False', 'On Tuesday open : 0800 close 2200 open overnight : False', 'On Wednesday open : 0800 close 2200 open overnight : False', 'On Thursday open : 0800 close 2200 open overnight : False', 'On Friday open : 0800 close 2200 open overnight : False', 'On Saturday open : 0800 close 2200 open overnight : False', 'On Sunday open : 0800 close 2100 open overnight : False']","[""Today was my first time eating here and it won't be the last time.\nI ordered through Postmates, that prices was easy and quick. I couldn't decide if I..."", 'Delicious meal.enjoyed very much.\n\nLoved that you where on the delivery list ...awesome', ""I've been eating here for as long as I can remember. My uncle Clifford use to take his sons, me my sister and brother to eat here as little kids. The jr...""]"
17,The Tripel Burger at the Tripel,the Tripel,The Tripel Burger ,https://www.timeout.com/los-angeles/restaurants/the-tripel,4,http://thetripel.com,'333 Culver Blvd Los Angeles 90293',"
From the same married chefs (Brooke Williamson and Nick Roberts) that opened Hudson House and Playa Provisions, The Tripel has been serving the Playa del Rey community with outstanding craft beer and quality food just a short stroll from the Pacific. Their beer list—or ""Social Lubrication,"" as they call it—rotates regularly, and features breweries like Smog City, Ballast Point and Strand Brewing. Grab a pint and join your fellow beer lovers at one of the communal tables, where you can also nosh on Tripel bites—steamed mussels and clams, the Tripel burger, and balsamic marinated onion rings, to name a few.
",DBsHbGCYAc2-FkIDd_mXUw,873,4.0,"['On Monday open : 1100 close 2200 open overnight : False', 'On Tuesday open : 1100 close 2200 open overnight : False', 'On Wednesday open : 1100 close 2200 open overnight : False', 'On Thursday open : 1100 close 2200 open overnight : False', 'On Friday open : 1100 close 0000 open overnight : False', 'On Saturday open : 1030 close 0000 open overnight : False', 'On Sunday open : 1030 close 2200 open overnight : False']","['Yelp 100 challenge 2020 #4\n\nHands down best burger I have had in a looong time.  I got the pretzel burger and wow!!! I know this place is a bar but I would...', 'Great Brunch Spot. Affordable prices. Bottomless Mimosas. Need I say more.\n\nService is attentive and helpful. \n\nSweet potato tots are great! \n\nCroque Madame...', 'Will a manager please reach out to me. I ordered a lamb b\nBUrger medium for takeout. Took a few bites and  my stomach hurt. I looked at the burger an this...']"
18,Plan Check Burger (PCB) at Plan Check,Plan Check,Plan Check Burger (PCB) ,https://www.timeout.com/los-angeles/restaurants/plan-check-2,4,http://www.plancheck.com,'1111 Wilshire Blvd Los Angeles 90017',"
Plan Check's third location brings fried chicken delicious-ness and one of the best burgers in town to DTLA denizens. But you'll find a few new items as well: a K-BBQ burger topped with kimcheese (gruyere seasoned with dried kimchi), a spicy tuna salad with sriracha vinaigrette, and beast fries, a dish that's as bohemeth is it sounds. Stick around for the restaurant's signature cruller donuts, or sidle up to the bar to nurse a S&L old fashioned while you watch all the pretty Downtown folk stroll by.
",UZlLBVnqs9Ikphin8CMVcA,1185,4.0,"['On Monday open : 1130 close 2100 open overnight : False', 'On Tuesday open : 1130 close 2100 open overnight : False', 'On Wednesday open : 1130 close 2100 open overnight : False', 'On Thursday open : 1130 close 2100 open overnight : False', 'On Friday open : 1130 close 2200 open overnight : False', 'On Saturday open : 1100 close 2200 open overnight : False', 'On Sunday open : 1100 close 2100 open overnight : False']","['I came here with a large party and they were very accommodating to us. I understand it can get very very hectic but they know how to handle it very well. We...', 'This review is for delivery orders - I wish I could give 5 stars but I had to deduct 2 stars for not being consistent and mixing up orders for delivery....', 'I was excited to try this since my buddies live above it and we wanted it to be a great place to make a regular hang out grab food type of thing. \n\nThe...']"
19,The Lowboy at Lowboy,Lowboy,The Lowboy ,https://www.timeout.com/los-angeles/bars/lowboy,no rating,https://lowboybar.com,'1540 Sunset Blvd Los Angeles 90026',"
This is a neighborhood bar, through and through. Unpretentious but elevated, the handful of cocktails lean classic (we're talking mai tais, old-fashioneds and mules), while there's always craft beer and Bud Heavy on draft. Of course the real apple of our eye is the Lowburger, one of the absolute best smashburgers anywhere in town (and available for under 10 bucks). Coupled with a Hall & Oates-heavy playlist, it makes for a sceney (but not too hip) gathering place. 
",fETqhZO6YjM1VTWCJpT8VA,85,4.5,"['On Monday open : 1700 close 0200 open overnight : True', 'On Tuesday open : 1700 close 0200 open overnight : True', 'On Wednesday open : 1700 close 0200 open overnight : True', 'On Thursday open : 1700 close 0200 open overnight : True', 'On Friday open : 1700 close 0200 open overnight : True', 'On Saturday open : 1200 close 0200 open overnight : True', 'On Sunday open : 1200 close 0200 open overnight : True']","['I love Lowboy! They are a great local spot! Was desperately craving a cheeseburger so ordered pickup and it did not disappoint! I was able to have an easy...', ""Still love this spot. The size of this place and the vibe is just awesome. \n\nHad a great gin martini and a couple beers with my wife.\n\nCan't wait to go back."", 'Came here after dinner at Masa Echo Park for a drink with my sister in law and we were super impressed with this cute little place! The aesthetic is dreamy...']"
