num,keyword,name,famous_for,link,rating_in_site,website,address,review,business_id,review_count,rating,open_hour,comment
20,Hamburguesa at Otono,Otono,Hamburguesa ,https://www.timeout.com/los-angeles/restaurants/otonyo,2,https://www.otonorestaurant.com,'5715 N Figueroa St Los Angeles 90042',"
The paucity of authentic—even passable—Spanish dining is one of the great gaps in the L.A. restaurant scene. And, as a man who considers any time he doesn’t spend in Spain as being ever so slightly wasted, word of a new addition is always welcome. I was thrilled to hear that chef Teresa Montaño—whose excellent provenance includes time in Valencia and in the kitchen at Pasadena’s now-shuttered Ración—was planning to open Otoño in Highland Park.
It all begins well enough. The superb drinks list at Otoño includes a commendable gin-and-tonics program, and the Gin & Tonic “Classico” reflects the seriousness with which that iconic cocktail is treated in Spain (the Spaniards drink more gin than any other nation on earth). Meanwhile, a glass of briny Manzanilla came at the perfect chilled temperature. When combined with some of the well-executed standards of the Spanish bar repertoire, there’s a feeling that everything is well with the world. The Boquerones y Mantequilla ($12) elegantly combines the vinegar sharpness of Spain’s beautiful canned anchovies with a rich goat milk butter, while the Gambas a la Plancha ($18), a small plate of griddled blue prawns, came perfectly prepared with a slight char on the shell—and meat cooked to retain a bite. The Croqueta de Jamón ($6)—a fritter filled with serrano ham—and the Croqueta de Setas y Maize ($6)—stuffed with mushroom and sweet corn—are good enough to pass muster in any Madrileño bar.
Once we delved deeper into the menu, however, standards began to decline; our table dismissed the Calamares en Su Tinta ($14) as tough and slimy. Calçots ($11) are traditionally spring onions from the Catalan region, and should be eaten “sword swallower”-style after being dipped in a pungent romesco sauce. The attempt to elevate the dish at Otoño using a single, larger green onion failed, primarily because of the undercooking of the main ingredient and the blandness of the romesco with which it was topped.
Spirits improved with the arrival of the sardines ($18), a single, plump and juicy grilled French sardine served atop escalavida—a layer of smoked grilled vegetables—which combined seafood freshness with the smoky crunch of the vegetables. But, we were quickly disappointed when a tangy green peppercorn sauce couldn’t disguise the fact that the Pollo Ahumado ($20) had been overcooked.
From her time in Spain, chef Montaño will know that a true paella is something to be taken very seriously as a joyous expresser of Valencian identity, which makes it even more disappointing that the arroz dishes at Otoño could best be described as two apologetic pans of over-salted parsimony. While the toppings on both the Mariscos ($32) and the Negra ($32), particularly the scallops on the Negra, show that the kitchen really knows how to cook seafood, the lack of soccarat—that essential layer of crisp rice—and the generous salting meant that what should have been the stars of the show were sadly left unfinished. 
Desserts struggled, too. A Crema Catalana ($10) was overpowered by cinnamon, and a Caña de Cabra cheesecake ($10) had so much salt that I assume it was prepared next to the person who made the rice dishes.
It’s no surprise that a new-ish restaurant is still figuring out its systems, and much can be forgiven for the genuine amiability of the staff. What’s more difficult to explain is the blistering rapidity with which the food arrived from kitchen to table: Our second visit broke records as every dish we ordered was piled onto the table within 20 minutes of ordering, despite requests to staff to slow things down. 
It’s a failing that is often enough to make me cross a restaurant off my list of regulars, but at Otoño it merely served to confirm my regretful belief that the restaurant is, for now, too inconsistent to plug that yawning Spanish gap in the Los Angeles food scene, and certainly doing little to dampen the serious Spain jones of yours truly. I shall continue to wait, although more in hope than expectation.



VITALS
WHERE TO SIT
Otoño is small enough that one table is more or less like any other another, so, arrive early and snag a seat at the bar—that’s where all the action seems to happen.
WHAT TO EAT
For the time being, Otoño best serves as a tapas-only destination. The Pan con Tomate ($5) here has just the right amount of garlic kick; order the Boquerones y Mantequilla; and the Conserva de Atún ($12), house-cured tuna, provides the perfect accompaniment to a glass of Fino. 
WHAT TO DRINK
In addition to the gin and tonics, there’s a sherry selection that not only offers versions across all the appropriate categories, but each is also served at the right temperature. The wine list offers bottles and glasses from some of Spain’s most well-known and lesser-known producing regions, and there’s a list of digestifs that offers Patxaran, a beloved Basque liquor, as well as some of the most wonderful but liver-shuddering brandies that have provided the end to far too many of my nights in Spain. 




VITALS
WHERE TO SIT
Otoño is small enough that one table is more or less like any other another, so, arrive early and snag a seat at the bar—that’s where all the action seems to happen.
WHAT TO EAT
For the time being, Otoño best serves as a tapas-only destination. The Pan con Tomate ($5) here has just the right amount of garlic kick; order the Boquerones y Mantequilla; and the Conserva de Atún ($12), house-cured tuna, provides the perfect accompaniment to a glass of Fino. 
WHAT TO DRINK
In addition to the gin and tonics, there’s a sherry selection that not only offers versions across all the appropriate categories, but each is also served at the right temperature. The wine list offers bottles and glasses from some of Spain’s most well-known and lesser-known producing regions, and there’s a list of digestifs that offers Patxaran, a beloved Basque liquor, as well as some of the most wonderful but liver-shuddering brandies that have provided the end to far too many of my nights in Spain. 


VITALS
WHERE TO SIT
Otoño is small enough that one table is more or less like any other another, so, arrive early and snag a seat at the bar—that’s where all the action seems to happen.
WHAT TO EAT
For the time being, Otoño best serves as a tapas-only destination. The Pan con Tomate ($5) here has just the right amount of garlic kick; order the Boquerones y Mantequilla; and the Conserva de Atún ($12), house-cured tuna, provides the perfect accompaniment to a glass of Fino. 
WHAT TO DRINK
In addition to the gin and tonics, there’s a sherry selection that not only offers versions across all the appropriate categories, but each is also served at the right temperature. The wine list offers bottles and glasses from some of Spain’s most well-known and lesser-known producing regions, and there’s a list of digestifs that offers Patxaran, a beloved Basque liquor, as well as some of the most wonderful but liver-shuddering brandies that have provided the end to far too many of my nights in Spain. 
",ktMHBqMj5XNfNIKdCI9GRg,329,4.0,"['On Thursday open : 1200 close 2000 open overnight : False', 'On Friday open : 1200 close 2000 open overnight : False', 'On Saturday open : 1200 close 2000 open overnight : False', 'On Sunday open : 1200 close 2000 open overnight : False']","[""I led a writing workshop at Oxy a few weeks back, and my friend Désirée Z. took me to dinner at Otoño afterward on the college's dime. We had an 8:30 or..."", ""Unfortunately, I have not been to Otono's prior to the quarantine. However, I'm so glad that I was able to purchase their black sourdough bread, their red..."", ""Chef Theresa will guide you through building you own take out selection. Pair it with a delicious Pinot and you won't mind the home quarantine. Please...""]"
21,The Belcampo Burger at Belcampo Meat Co.,Belcampo Meat Co.,The Belcampo Burger ,https://www.timeout.com/los-angeles/restaurants/belcampo-meat-co,4,http://www.belcampomeatco.com,'Grand Central Market 317 S Broadway Los Angeles 90013',"
Serving as both a butcher shop and a burger joint, Belcampo Meat Co. has expanded to Downtown's Grand Central Market, offering customers a solid lunch spot to grab a burger, pulled pork sandwich, or maybe even pick up a pound of ground beef to bring home. The company prides itself on sustainable, organic meat, a practice that is readily apparent as soon as you bite into one of their famed cheeseburgers. Oh, and they make their own vinegar slaw, ketchup and aioli, so everything tastes like it was whipped up just for you.
",ZZ3fF9j-pEfZvvif1fLlfw,514,4.0,"['On Monday open : 1100 close 2000 open overnight : False', 'On Tuesday open : 1100 close 2000 open overnight : False', 'On Wednesday open : 1100 close 2000 open overnight : False', 'On Thursday open : 1100 close 2000 open overnight : False', 'On Friday open : 1100 close 2000 open overnight : False', 'On Saturday open : 1100 close 2000 open overnight : False', 'On Sunday open : 1100 close 2000 open overnight : False']","['I love this place!!! I have always been a huge fan of their burgers. There is so much to choose from. I am glad there are open during this quarantine. Would...', ""Yum always delicious And on time! I'm grateful we can get  nourished with this business though quarantine."", 'Belcampo has one of the best burgers in LA!  I recently ordered the Double Fast Burger, fries and a side kale salad. Not only was everything delicious, but...']"
22,Napalm Death at Grill 'Em All,Grill 'Em All,Napalm Death ,https://www.timeout.com/los-angeles/restaurants/grill-em-all,5,http://grillemallburgs.com,'19 E Main St Alhambra 91801',"
Alhambra’s metal-themed, meat-slinging burger shop doesn’t serve a single patty that’s not obscenely dressed. There’s the Dee Snider, smothered in peanut butt, jam, bacon and sriracha; and the Exciter, made with duck confit, frise, herb goat cheese and cranberry gastrique. But the Napalm Death ($12) tops them all: a medium-rare, half-pound patty drenched in gooey pepperjack, pickled jalapeños and cream cheese, topped off with fried jalapeño poppers and habanero aioli. It’s what we’ll dine on when the valkyries carry us over the rainbow bridge to Valhalla (which may be because it kills us as we’re eating it).
",53UyLtU4F7seRkPfL6TY6Q,2416,4.0,"['On Monday open : 1100 close 2100 open overnight : False', 'On Tuesday open : 1100 close 2100 open overnight : False', 'On Wednesday open : 1100 close 2100 open overnight : False', 'On Thursday open : 1100 close 2100 open overnight : False', 'On Friday open : 1100 close 2100 open overnight : False', 'On Saturday open : 1100 close 2100 open overnight : False', 'On Sunday open : 1100 close 2100 open overnight : False']","[""I cannot even explain how incredibly amazing this burger is!!! Since this whole covid19 situation we've had to order in a few times from different places..."", ""I go here once in a while and I've always had a great experience. Went to get takeout on Friday due to covid-19 and had great service and felt safe. I want..."", 'The best people and the best place to just kick back with a great brew and an amazing burg! In times like these we need to support the people who will be...']"
23,Cheeseburger at Burgerlords,Burgerlords,Cheeseburger ,https://www.timeout.com/los-angeles/restaurants/burgerlords,no rating,http://www.burgerlords.com,'943 North Broadway #102 Los Angeles 90012',"
Fred and Max Guerrero grew up obsessed with burgers as the kids of the founder of local fast-casual burger chain Oinkster. They turned that obsession into a Tumblr called Burgerlords which eventually inspired this IRL eatery (and its sister cafe in Highland Park). The idea is a retro-style burger stand with a menu almost as simple as In-N-Out's, but updated and upgraded. Burgers here feature a custom tri-blend grass-fed beef (or a housemade vegan patty alternative) with classic toppings. On the side, your choices are fries or the 'Lord of the Fries,' a rather Animal-style-esque combo of fries with melted cheese, grilled onions and thousand island dressing (a dairy-free version is also available). 
",ierxTDAcyBrBXFyMadrAlA,778,4.0,"['On Tuesday open : 1100 close 2200 open overnight : False', 'On Wednesday open : 1100 close 2200 open overnight : False', 'On Thursday open : 1100 close 2200 open overnight : False', 'On Friday open : 1100 close 2200 open overnight : False', 'On Saturday open : 1100 close 2200 open overnight : False', 'On Sunday open : 1100 close 2200 open overnight : False']","['I have been wanting to try this place for a long time since a lot of people hype this place up. A vegan friend of mine was visiting town so I thought this...', 'One word... ""DELICIOUS!""\n\nBest vegan shakes I\'ve ever had. Vegan nuggets were amazing. They make the vegan patties themselves, and those are absolutely...', 'Well today I find myself in Chinatown and hungry.  Not feeling Chinese food today, I remembered a co-worker told me about this place, so here is my...']"
24,Two-Hand Burger at Herringbone Santa Monica,Herringbone Santa Monica,Two-Hand Burger ,https://www.timeout.com/los-angeles/restaurants/herringbone-santa-monica,5,http://herringboneeats.com/santa-monica/ringboneeats.com,'1755 Ocean Ave Los Angeles',"
With a successful Herringbone location in West Hollywood, the second location in Santa Monica is that much closer to the ocean, where most of its menu draws its inspiration from. Shuck a few oysters, crack open a whole lobster and let the East Coast come to you.
",9ae3kb6ARyagx2Dr96vupA,798,4.0,"['On Monday open : 1600 close 2200 open overnight : False', 'On Tuesday open : 1600 close 2200 open overnight : False', 'On Wednesday open : 1600 close 2200 open overnight : False', 'On Thursday open : 1600 close 2200 open overnight : False', 'On Friday open : 1600 close 2300 open overnight : False', 'On Saturday open : 1000 close 2300 open overnight : False', 'On Sunday open : 1000 close 2100 open overnight : False']","['Good oysters\n\nThe Beni was delicious\n\n\nFor the bottomless mimosas\nThey need to refill properly and when I say refill the waitress only filled our glasses...', 'Had an excellent brunch here this weekend. Bottomless mimosas or rose for $25, consider it done! Make sure to arrive with enough time to take advantage of...', ""1.5 rating!! It was Valentine's Day so my bf called & asked if there was a wait for 2 people. The hostess asked to put us on hold so she could check....""]"
